<?xml version="1.0" encoding="utf-8" standalone="no"?>
<!DOCTYPE healthy-food-catalog SYSTEM "healthy-food-catalog.dtd">
<?xml-stylesheet type="text/xsl" href="html_transformation4.xsl"?>

<healthy-food-catalog>
    <foods>
        <food>
            <name>Броколи</name>
            <image>broccoli.jpg</image>
            <category type="Зеленчук"/>
            <benefits> 1.Намаляват възпаленията.
                2.Предпазват срещу някои видове рак.
                3.Поддържат здравето на сърцето.
                4.Подобряват храносмилането и намаляват запека.
                5.Поддържат здрава умствена функция.
                6.Забавят процеса на стареене.
            </benefits>
            <price grams="500g">2.30лв</price>
            <texture>Листата - меки, стъблата и дръжките - твърди</texture>
            <consistency>Хрупкави</consistency>
            <expire-date storage="хладилник">1-2 седмици</expire-date>
            <flavour alternative="мек">приятен</flavour>
            <appearance>
                <size>60-90см.</size>
                <shape>дървовидна</shape>
                <color>тъмно зелен</color>
            </appearance>
            <nutritional-content size="500g">
                <calories>170</calories>
                <carbs sugars="7.5g">20g</carbs>
                <fat saturated="0.2g">2g</fat>
                <protein>14g</protein>
                <vitamin quantity="25%">C</vitamin>
            </nutritional-content>
            <recipe name="Задушени броколи със сирене">
                <products>
                    броколи - 1 глава
                    краве масло - 35 г
                    зехтин - 2 с.л.
                    прясно мляко - 1 к.ч.
                    чесън - 1 - 2 скилидки
                    сирене - 200 г
                    чери домати - 200 г
                    сол - на вкус
                    черен пипер - на вкус (по желание)
                    лимонов сок - от 1/2 лимон
                </products>
                <preparation>
                    Загрейте вода на силен огън с лъжица зехтин или олио и малко сол.
                    Разчленете броколите на розички, измийте и бланширайте във врящата вода.
                    Сипете млякото, за да омекоти вкуса на зеленчука.
                    Броколите трябва леко да омекнат, а не да се сварят.
                    Извадете ги с решетъчна лъжица и пуснете в тиган с разтопеното масло, малко зехтин, сол и накълцана скилидка - две чесън. Задушете под капак за 10 минути, като сипете и малко от бульона от варенето.
                    Зеленчукът е хубаво да остане меко хрупкав, не да се разпада. Той ще си поеме маслото и аромата на чесън.
                    Разпределете на порции и към броколите нарежете чери домати.
                    Поръсете с черен пипер по желание, малко лимонов сок и отгоре натрошете сирене.
                    Би било хубаво и ако леко се запече в загрята на 200 градуса фурна, но и без това се получава страхотно.
                    Сервирайте топли, задушените броколи с полуразтопеното от топлината сирене върху тях.
                </preparation>
                <time>
                    30-40 минути
                </time>
            </recipe>
            <ethical-production>
                <country part="Средиземноморски регион">Италия</country>
            </ethical-production>
        </food>

    </foods>


</healthy-food-catalog>